A1: Bezpieczeñstwo systemów informatycznych | I1: jesieñ 2006/2007 | V1: studia dzienne
A2: Grupa | B2: 513 | C2: alfa123 | F2: B | H2: komp | J2: 533Gnn | P2: Czwartek | V2: godz. 10.00
F3: F | H3: has³o | J3: Wano243y
A4: Lp. | B4: Nazwisko i imiê | C4: Komp | D4: 38995 | E4: 39002 | F4: 39009 | G4: 39016 | H4: 39030 | I4: 39037 | J4: 39044 | K4: 39051 | L4: 39058 | M4: 39065 | N4: 39072 | O4: 38721 | P4: 38728 | Q4: 38735 | R4: 38742 | T4: Iloœæ NB i SP | U4: Suma za zadania | W4: Test 18.01 | X4: Test | AA4: Suma uzyskanych punktów | AC4: Ocena wyliczona
A5: 1 | B5: Adamska Paulina | C5: 4/4.6 | F5: 4.4 | G5: 5 | H5: 4.1 | I5: 5 | J5: 3.5 | K5: 5 | L5: 5 | M5: 5 | N5: 4 | T5: =COUNTIF(D5:S5,"nb")+COUNTIF(D5:S5,"sp") -> 0 | U5: =SUM(D5:S5) -> 41 | AA5: =U5+IF(Y5<>"",Y5,IF(X5<>"",X5,W5)) -> 41 | AC5: =IF(AA5<$AA$25,2,IF(AA5<$AA$26,3,IF(AA5<$AA$27,3.5,IF(AA5<$AA$28,4,IF(AA5<$AA$29,4.5,5))))) -> 2
A6: 2 | B6: Biegañski Maciej | C6: 14/4.4 | F6: 4.4 | G6: 3.9 | H6: 1.4 | I6: 5 | J6: 5 | K6: 4.5 | L6: nb | M6: 5 | N6: 00.7 | T6: =COUNTIF(D6:S6,"nb")+COUNTIF(D6:S6,"sp") -> 1 | U6: =SUM(D6:S6) -> 29.9 | AA6: =U6+IF(Y6<>"",Y6,IF(X6<>"",X6,W6)) -> 29.9 | AC6: =IF(AA6<$AA$25,2,IF(AA6<$AA$26,3,IF(AA6<$AA$27,3.5,IF(AA6<$AA$28,4,IF(AA6<$AA$29,4.5,5))))) -> 2
A7: 3 | B7: Bieniek Szymon | C7: 15/4.5 | F7: 5 | G7: 5 | H7: 4.8 | I7: 5 | J7: 5 | K7: 5 | L7: 5 | M7: 5 | N7: 4 | T7: =COUNTIF(D7:S7,"nb")+COUNTIF(D7:S7,"sp") -> 0 | U7: =SUM(D7:S7) -> 43.8 | AA7: =U7+IF(Y7<>"",Y7,IF(X7<>"",X7,W7)) -> 43.8 | AC7: =IF(AA7<$AA$25,2,IF(AA7<$AA$26,3,IF(AA7<$AA$27,3.5,IF(AA7<$AA$28,4,IF(AA7<$AA$29,4.5,5))))) -> 2
A8: 4 | B8: Bucior Piotr | C8: 17/4.15 | F8: 5 | G8: 3 | H8: 2.2 | I8: nb | J8: nb | K8: 5 | L8: 5 | M8: 5 | N8: 5 | T8: =COUNTIF(D8:S8,"nb")+COUNTIF(D8:S8,"sp") -> 2 | U8: =SUM(D8:S8) -> 30.2 | AA8: =U8+IF(Y8<>"",Y8,IF(X8<>"",X8,W8)) -> 30.2 | AC8: =IF(AA8<$AA$25,2,IF(AA8<$AA$26,3,IF(AA8<$AA$27,3.5,IF(AA8<$AA$28,4,IF(AA8<$AA$29,4.5,5))))) -> 2
A9: 5 | B9: Chmura Micha³ | C9: 6/4.8 | F9: 4.4 | G9: 4.6 | H9: nb | I9: 3.6 | J9: 3.5 | K9: 5 | L9: 4.5 | M9: nb | N9: nb | T9: =COUNTIF(D9:S9,"nb")+COUNTIF(D9:S9,"sp") -> 3 | U9: =SUM(D9:S9) -> 25.6 | AA9: =U9+IF(Y9<>"",Y9,IF(X9<>"",X9,W9)) -> 25.6 | AC9: =IF(AA9<$AA$25,2,IF(AA9<$AA$26,3,IF(AA9<$AA$27,3.5,IF(AA9<$AA$28,4,IF(AA9<$AA$29,4.5,5))))) -> 2
A10: 6 | B10: Cichocki Rados³aw | C10: 16/4.14 | F10: 4.4 | G10: 2.9 | H10: 3.3 | I10: 2.5 | J10: 4.5 | K10: nb | L10: nb | M10: 5 | N10: 5 | T10: =COUNTIF(D10:S10,"nb")+COUNTIF(D10:S10,"sp") -> 2 | U10: =SUM(D10:S10) -> 27.6 | AA10: =U10+IF(Y10<>"",Y10,IF(X10<>"",X10,W10)) -> 27.6 | AC10: =IF(AA10<$AA$25,2,IF(AA10<$AA$26,3,IF(AA10<$AA$27,3.5,IF(AA10<$AA$28,4,IF(AA10<$AA$29,4.5,5))))) -> 2
A11: 7 | B11: Ciechomski Piotr | C11: 2/4.2 | F11: 4.2 | G11: 4.3 | H11: 2.5 | I11: 4.5 | J11: 5 | K11: 4.1 | L11: nb | M11: 5 | N11: 1.1 | T11: =COUNTIF(D11:S11,"nb")+COUNTIF(D11:S11,"sp") -> 1 | U11: =SUM(D11:S11) -> 30.7 | AA11: =U11+IF(Y11<>"",Y11,IF(X11<>"",X11,W11)) -> 30.7 | AC11: =IF(AA11<$AA$25,2,IF(AA11<$AA$26,3,IF(AA11<$AA$27,3.5,IF(AA11<$AA$28,4,IF(AA11<$AA$29,4.5,5))))) -> 2
A12: 8 | B12: Cyrta Ewelina | C12: 13/4.3 | F12: 4.4 | G12: 4.5 | H12: 2.7 | I12: 5 | J12: 5 | K12: 5 | L12: nb | M12: 5 | N12: 00.7 | T12: =COUNTIF(D12:S12,"nb")+COUNTIF(D12:S12,"sp") -> 1 | U12: =SUM(D12:S12) -> 32.3 | AA12: =U12+IF(Y12<>"",Y12,IF(X12<>"",X12,W12)) -> 32.3 | AC12: =IF(AA12<$AA$25,2,IF(AA12<$AA$26,3,IF(AA12<$AA$27,3.5,IF(AA12<$AA$28,4,IF(AA12<$AA$29,4.5,5))))) -> 2
A13: 9 | B13: Czerski Jan | C13: 18/238 | F13: 4.4 | G13: 5 | H13: nb | I13: 5 | J13: 4.5 | K13: 5 | L13: 4.5 | M13: 3 | N13: nb | T13: =COUNTIF(D13:S13,"nb")+COUNTIF(D13:S13,"sp") -> 2 | U13: =SUM(D13:S13) -> 31.4 | AA13: =U13+IF(Y13<>"",Y13,IF(X13<>"",X13,W13)) -> 31.4 | AC13: =IF(AA13<$AA$25,2,IF(AA13<$AA$26,3,IF(AA13<$AA$27,3.5,IF(AA13<$AA$28,4,IF(AA13<$AA$29,4.5,5))))) -> 2
A14: 10 | B14: Kwaœniewski Tomasz | C14: 1/4.1 | D14: nb | F14: 4.2 | G14: 3.6 | H14: 3.3 | I14: 5 | J14: 5 | K14: 5 | L14: 5 | M14: 5 | N14: nb | T14: =COUNTIF(D14:S14,"nb")+COUNTIF(D14:S14,"sp") -> 2 | U14: =SUM(D14:S14) -> 36.1 | AA14: =U14+IF(Y14<>"",Y14,IF(X14<>"",X14,W14)) -> 36.1 | AC14: =IF(AA14<$AA$25,2,IF(AA14<$AA$26,3,IF(AA14<$AA$27,3.5,IF(AA14<$AA$28,4,IF(AA14<$AA$29,4.5,5))))) -> 2
A15: 11 | B15: Miko³ajczyk Marcin | C15: 12/4.7 | F15: 4.4 | G15: 3.2 | H15: 4.8 | I15: 5 | J15: 3.5 | K15: 5 | L15: 5 | M15: 5 | N15: 1.1 | T15: =COUNTIF(D15:S15,"nb")+COUNTIF(D15:S15,"sp") -> 0 | U15: =SUM(D15:S15) -> 37 | AA15: =U15+IF(Y15<>"",Y15,IF(X15<>"",X15,W15)) -> 37 | AC15: =IF(AA15<$AA$25,2,IF(AA15<$AA$26,3,IF(AA15<$AA$27,3.5,IF(AA15<$AA$28,4,IF(AA15<$AA$29,4.5,5))))) -> 2
A16: 12 | B16: PoŸniak Franciszek | C16: 7/4.9 | F16: 4.4 | G16: 4.3 | H16: 3.1 | I16: 5 | J16: 4 | K16: nb | L16: 0 | M16: 5 | N16: 5 | T16: =COUNTIF(D16:S16,"nb")+COUNTIF(D16:S16,"sp") -> 1 | U16: =SUM(D16:S16) -> 30.8 | AA16: =U16+IF(Y16<>"",Y16,IF(X16<>"",X16,W16)) -> 30.8 | AC16: =IF(AA16<$AA$25,2,IF(AA16<$AA$26,3,IF(AA16<$AA$27,3.5,IF(AA16<$AA$28,4,IF(AA16<$AA$29,4.5,5))))) -> 2
A17: 13 | B17: Prochenka Rafa³ | C17: 11/4.10 | F17: 4.4 | G17: 4.3 | H17: 4.7 | I17: 5 | J17: 5 | K17: 5 | L17: 5 | M17: 5 | N17: 4.7 | T17: =COUNTIF(D17:S17,"nb")+COUNTIF(D17:S17,"sp") -> 0 | U17: =SUM(D17:S17) -> 43.1 | AA17: =U17+IF(Y17<>"",Y17,IF(X17<>"",X17,W17)) -> 43.1 | AC17: =IF(AA17<$AA$25,2,IF(AA17<$AA$26,3,IF(AA17<$AA$27,3.5,IF(AA17<$AA$28,4,IF(AA17<$AA$29,4.5,5))))) -> 2
A18: 14 | B18: Radomski £ukasz | C18: 8/4.12 | F18: 5 | G18: 4.3 | H18: 4.2 | I18: 5 | J18: 4 | K18: 5 | L18: 5 | M18: 5 | N18: nb | T18: =COUNTIF(D18:S18,"nb")+COUNTIF(D18:S18,"sp") -> 1 | U18: =SUM(D18:S18) -> 37.5 | AA18: =U18+IF(Y18<>"",Y18,IF(X18<>"",X18,W18)) -> 37.5 | AC18: =IF(AA18<$AA$25,2,IF(AA18<$AA$26,3,IF(AA18<$AA$27,3.5,IF(AA18<$AA$28,4,IF(AA18<$AA$29,4.5,5))))) -> 2
A19: 15 | B19: Rembikowski Adam | C19: 5/4.13 | F19: 4.4 | G19: 3.6 | H19: 0 | I19: 5 | J19: 4 | K19: 5 | L19: 5 | M19: 5 | N19: 4.7 | T19: =COUNTIF(D19:S19,"nb")+COUNTIF(D19:S19,"sp") -> 0 | U19: =SUM(D19:S19) -> 36.7 | AA19: =U19+IF(Y19<>"",Y19,IF(X19<>"",X19,W19)) -> 36.7 | AC19: =IF(AA19<$AA$25,2,IF(AA19<$AA$26,3,IF(AA19<$AA$27,3.5,IF(AA19<$AA$28,4,IF(AA19<$AA$29,4.5,5))))) -> 2
A20: 16 | B20: Sarat Maciej | C20: 3/4.11 | F20: 4.4 | G20: 5 | H20: 3.9 | I20: 5 | J20: 4 | K20: 5 | L20: 5 | M20: 5 | N20: 5 | T20: =COUNTIF(D20:S20,"nb")+COUNTIF(D20:S20,"sp") -> 0 | U20: =SUM(D20:S20) -> 42.3 | AA20: =U20+IF(Y20<>"",Y20,IF(X20<>"",X20,W20)) -> 42.3 | AC20: =IF(AA20<$AA$25,2,IF(AA20<$AA$26,3,IF(AA20<$AA$27,3.5,IF(AA20<$AA$28,4,IF(AA20<$AA$29,4.5,5))))) -> 2
B22: Numer realizowanego æwiczenia | D22: 1 | E22: 2 | F22: 3 | G22: 4 | H22: 5 | I22: 6 | J22: 7 | K22: 8 | L22: 9 | M22: 10 | N22: 11 | O22: 12 | P22: 13 | Q22: T | R22: PW
W24: Max pkt. | X24: =11*5+40 -> 95 | AA24: Minima punktowe
C25: Nieobecnoœci | X25: 0.5 | Z25: = | AA25: =$X$24*X25 -> 47.5 | AB25: pkt. - ocena dst.
C26: SpóŸnienia - liczone jak nieobecnoœci | X26: 00.6 | Z26: = | AA26: =$X$24*X26 -> 57 | AB26: pkt. - ocena dst+.
C27: Karne obni¿enie oceny | X27: 00.7 | Z27: = | AA27: =$X$24*X27 -> 66.5 | AB27: pkt. - ocena db.
C28: Poz. 6 /lab6 - wyjmuje dysk przy w³¹czonym zasilaniu !!! | X28: 00.8 | Z28: = | AA28: =$X$24*X28 -> 76 | AB28: pkt. - ocena db+.
X29: 00.9 | Z29: = | AA29: =$X$24*X29 -> 85.5 | AB29: pkt. - ocena bdb.